ファイル名,表紙テキスト,フック,問題,解説,解決,最後1,最後2
theme10_reel_01,採れない採用,応募が来ているのに採用できない会社の共通点,応募数はあるのに内定につながらない状態が続いています,ミスマッチな応募者が多く選考コストだけがかかっている状態です,採用LPで事前フィルターをかけることで本気の応募者を集めやすくなります,採用のやり方を見直すなら,リンクの無料診断からどうぞ
theme10_reel_02,当日すっぽかし,面接当日に来ない問題の根本原因を知っていますか,面接日程を調整したのに当日の無断キャンセルが起きています,志望度の低い応募者を選考に進めるほど当日辞退は増えていきます,採用LPで自社を深く理解してから応募させると当日辞退が減ります,採用に行き詰まっている方は,お気軽にメッセージをどうぞ
theme10_reel_03,対応コストの盲点,志望度の低い応募者に対応するコストを計算しましたか,書類選考・日程調整・面接と採用できない人のために大量の時間を使っています,採用ページの情報が薄いほど「とりあえず応募」する人が増えます,採用LPに深い情報を載せることで応募者の質を根本から改善できます,自社の採用力がわかる,無料診断はプロフィールから
theme10_reel_04,即離職の種,「とりあえず採用」した人がどうなるか想像できますか,他に受かったらそっちへ行こうと思って来た人を採用しています,志望度の低い人材を採る判断が現場のモチベーションを下げていきます,採用LPで本気の人だけを選別することが現場の質を守ることにつながります,まずは採用ページを見直して,質問はメッセージでどうぞ
theme10_reel_05,フィルターの設計,本気の応募者だけを集めるフィルターが採用LPです,採用コスト・現場の負担・離職コストは志望度の低い採用から生まれます,フィルターなしの採用は量を追うほど会社が消耗しやすくなります,自社理念と仕事のリアルを深く伝える採用LPが自然なフィルターになります,採用ページに関するご相談は,いつでもメッセージをどうぞ
theme10_reel_06,理念で集める,自社の理念を読んでから来る応募者はまったく違います,条件だけで来た人と理念に共感して来た人では面接の質が全く違います,採用LPに社長の言葉と信念を載せることが質の高い採用への第一歩です,理念共感型の採用LPが長く働く人材を引き寄せやすくなります,具体的な改善のステップは,メッセージでご質問ください
